Mã công đoàn,Tên công đoàn,Số điện thoại liên hệ,Tên liên đoàn cấp trên,Địa chỉ
,CÔNG ĐOÀN NGÂN HÀNG VIỆT NAM,0438513168-0438513169,TỔNG LIÊN ĐOÀN LAO ĐỘNG VIỆT NAM,"Số 6 ngõ 82, phố Dịch Vọng Hậu, phường Dịch Vọng Hậu, quận Cầu Giấy, Hà Nội"
,CÔNG ĐOÀN DẦU KHÍ VIỆT NAM,437725985,TỔNG LIÊN ĐOÀN LAO ĐỘNG VIỆT NAM,Địa chỉ: Tầng 8 tòa nhà Petrovietnam 18 Láng Hạ - Ba Đình - Hà Nội
,CÔNG ĐOÀN GIÁO DỤC VIỆT NAM,0438453118,TỔNG LIÊN ĐOÀN LAO ĐỘNG VIỆT NAM,"Số 2 Trịnh Hoài Đức, quận Đống Đa, thành phố Hà Nội"
,CÔNG ĐOÀN THAN – KHOÁNG SẢN VIỆT NAM,0463284245,TỔNG LIÊN ĐOÀN LAO ĐỘNG VIỆT NAM,"226 Lê Duẩn, phường Phương Liệt, quận Đống Đa, thành phố Hà Nội"
,CÔNG ĐOÀN TỔNG CÔNG TY HÀNG KHÔNG VIỆT NAM,438721764,TỔNG LIÊN ĐOÀN LAO ĐỘNG VIỆT NAM,"Số 202B Nguyễn Sơn, quận Long Biên, thành phố Hà Nội"
,BAN CÔNG ĐOÀN QUỐC PHÒNG,069554158,TỔNG LIÊN ĐOÀN LAO ĐỘNG VIỆT NAM,"25A Phan Đình Phùng, thành phố Hà Nội"
,CÔNG ĐOÀN VIÊN CHỨC VIỆT NAM,437672611,TỔNG LIÊN ĐOÀN LAO ĐỘNG VIỆT NAM,"101/165 Dương Quảng Hàm, Cầu Giấy, Hà Nội"
,BAN CÔNG ĐOÀN CÔNG AN NHÂN DÂN,37481361–06920760–06922803,TỔNG LIÊN ĐOÀN LAO ĐỘNG VIỆT NAM,"Số 47 Phạm Văn Đồng, quận Cầu Giấy, thành phố Hà Nội"
,CÔNG ĐOÀN THÔNG TIN VÀ TRUYỀN THÔNG VIỆT NAM,437741570,TỔNG LIÊN ĐOÀN LAO ĐỘNG VIỆT NAM,"Số 13 Ngõ Hàng Bột, Phường Cát Linh, Quận Đống Đa, TP Hà Nội"
,CÔNG ĐOÀN ĐƯỜNG SẮT VIỆT NAM,38221759,TỔNG LIÊN ĐOÀN LAO ĐỘNG VIỆT NAM,"118 Lê Duẩn, quận Hoàn Kiếm, thành phố Hà Nội"
,CÔNG ĐOÀN NÔNG NGHIỆP VÀ PHÁT TRIỂN NÔNG THÔN VIỆT NAM,02439712700,TỔNG LIÊN ĐOÀN LAO ĐỘNG VIỆT NAM,"Số 12/20 Nguyễn Công Hoan, quận Ba Đình, thành phố Hà Nội"
,CÔNG ĐOÀN Y TẾ VIỆT NAM,38461716,TỔNG LIÊN ĐOÀN LAO ĐỘNG VIỆT NAM,"138C Giảng Võ, Ba Đình, thành phố Hà Nội"
,CÔNG ĐOÀN DỆT MAY VIỆT NAM,0436339839,TỔNG LIÊN ĐOÀN LAO ĐỘNG VIỆT NAM,460 Minh khai- Hai bà Trưng- Hà Nội
,CÔNG ĐOÀN XÂY DỰNG VIỆT NAM,38252977,TỔNG LIÊN ĐOÀN LAO ĐỘNG VIỆT NAM,"12 Cửa Đông, quận Hoàn Kiếm, thành phố Hà Nội"
,CÔNG ĐOÀN CÔNG THƯƠNG VIỆT NAM,2439348922,TỔNG LIÊN ĐOÀN LAO ĐỘNG VIỆT NAM,"Số 21 Ngô Quyền, Q Hoàn Kiếm, Tp Hà Nội"
,CÔNG ĐOÀN GIAO THÔNG VẬN TẢI VIỆT NAM,38259718,TỔNG LIÊN ĐOÀN LAO ĐỘNG VIỆT NAM,"1B Ngô Quyền, Quận Hoàn Kiếm, thành phố Hà Nội"
,CÔNG ĐOÀN TỔNG CÔNG TY HÀNG HẢI VIỆT NAM,35770919,TỔNG LIÊN ĐOÀN LAO ĐỘNG VIỆT NAM,"Tầng 15, Tòa nhà Ocean Park, số 1 Đào Duy Anh, quận Đống Đa, thành phố Hà Nội"
,Công đoàn Tổng công ty Thép Việt Nam - CTCP,02438561767,TỔNG LIÊN ĐOÀN LAO ĐỘNG VIỆT NAM,"91 P Láng Hạ, Láng Hạ, Đống Đa, Hà Nội"
,Công đoàn Tổng công ty Quản lý bay Việt Nam,02438271513,TỔNG LIÊN ĐOÀN LAO ĐỘNG VIỆT NAM,"P Lâm Hạ, Bồ Đề, Long Biên, Hà Nội"
,Công đoàn Tổng công ty Giấy Việt Nam,02438247773,TỔNG LIÊN ĐOÀN LAO ĐỘNG VIỆT NAM,"25 P Lý Thường Kiệt, Phan Chu Trinh, Hoàn Kiếm, Hà Nội"
,Công đoàn Công nghiệp Tàu thủy Việt Nam,02437711212,TỔNG LIÊN ĐOÀN LAO ĐỘNG VIỆT NAM,"172 P Ngọc Khánh, Giảng Võ, Ba Đình, Hà Nội"
,Công đoàn Cao su Việt Nam,02838443690,TỔNG LIÊN ĐOÀN LAO ĐỘNG VIỆT NAM,"229 Hoàng Văn Thụ, Phường 8, Phú Nhuận, Thành phố Hồ Chí Minh"
,Công đoàn Điện lực Việt Nam,02439362897,TỔNG LIÊN ĐOÀN LAO ĐỘNG VIỆT NAM,"11 Cửa Bắc, Trúc Bạch, Ba Đình, Hà Nội"
,CĐCS Viện Sốt rét - Ký sinh trùng - Côn trùng Trung ương,438544326,CÔNG ĐOÀN Y TẾ VIỆT NAM ,Số 35 Trung Văn - Phường Trung Văn - Quận Nam Từ Liêm - Hà Nội
,CĐCS Viện Sốt rét - Ký sinh trùng Côn trùng Quy Nhơn,563547492,CÔNG ĐOÀN Y TẾ VIỆT NAM ,611B Nguyễn Thái Học - Tp. Quy Nhơn - T.Bình Định.
,CĐCS Viện Pháp Y Tâm thần Trung ương,433851260,CÔNG ĐOÀN Y TẾ VIỆT NAM ,"Xã Hòa Bình, Huyện Thường Tín, Hà Nội."
,CĐCS Viện Kiểm nghiệm ATVSTP Quốc gia,439335741,CÔNG ĐOÀN Y TẾ VIỆT NAM ,"65 Phạm Thận Duật, Mai Dịch, Cầu Giấy, Hà Nội"
,CĐCS Viện Vệ sinh Dịch tễ Tây nguyên,5003852694,CÔNG ĐOÀN Y TẾ VIỆT NAM ,"34 Phạm Hùng, phường Tân An,  thành phố Buôn Ma Thuột, tỉnh Đăk Lăk"
,CĐCS Viện Y học Biển,313519317,CÔNG ĐOÀN Y TẾ VIỆT NAM ,"Đại lộ Võ Nguyên Giáp , P.Kênh Dương, Q.Lê Chân - TP. Hải Phòng"
,Viện vắc xin và Sinh phẩm Y tế,583822408,CÔNG ĐOÀN Y TẾ VIỆT NAM ,Số 9 Pasteur – Nha Trang
,Viện Sức khỏe nghề nghiệp & Môi trường,438213491,CÔNG ĐOÀN Y TẾ VIỆT NAM ,"57 Lê Quý Đôn, Quận Hai Bà Trưng, Hà Nội"
,Viện Trang thiết bị & Công trình Y tế,438523065,CÔNG ĐOÀN Y TẾ VIỆT NAM ,Số 40 Phương Mai - Đống Đa - Hà Nội
,Trung tâm Nghiên cứu Sản xuất Vắc xin - Sinh phẩm Y tế,439710581,CÔNG ĐOÀN Y TẾ VIỆT NAM ,"418 Vĩnh Hưng ,Hoàng Mai, TP. Hà Nội"
,Viện Pháp Y Tâm thần Trung ương Biên Hòa,613816584,CÔNG ĐOÀN Y TẾ VIỆT NAM ,"Nguyễn Ái Quốc, Tân Phong, Tp. Biên Hòa, Đồng Nai"
,Trung tâm Điều phối QG ghép bộ phận cơ thể người,4 39386692,CÔNG ĐOÀN Y TẾ VIỆT NAM ,"40 Tràng Thi, Hà Nội"
,Viện Dược liệu,438.252.644,CÔNG ĐOÀN Y TẾ VIỆT NAM ,"3B Quang Trung, Quận Hoàn Kiếm, Hà Nội"
,Viện Chiến lược và Chính sách Y tế,438.234.167,CÔNG ĐOÀN Y TẾ VIỆT NAM ,Ngõ A36 - Đường Hồ Tùng Mậu - Mai Dịch - Cầu Giấy - Hà Nội
,Viện Dinh dưỡng Quốc gia,43.971.709,CÔNG ĐOÀN Y TẾ VIỆT NAM ,48B - Tăng Bạt Hổ - Quận Hai Bà Trưng - Hà Nội
,Viện Kiểm nghiệm thuốc TW,438.252.791,CÔNG ĐOÀN Y TẾ VIỆT NAM ,"48 Hai Bà Trưng, Hoàn Kiếm, Hà Nội"
,Viện Vệ sinh dịch tễ TW,439.716.356,CÔNG ĐOÀN Y TẾ VIỆT NAM ,Số 1 - Phố Yecxanh - Quận Hai Bà Trưng - Hà Nội
,Viện Kiểm định quốc gia văcxin và Sinh phẩm Y tế,438.553.148,CÔNG ĐOÀN Y TẾ VIỆT NAM ,Phường Đại Kim - Quận Hoàng Mai - TP. Hà Nội
,Viện Pasteur Nha Trang,583.822.406,CÔNG ĐOÀN Y TẾ VIỆT NAM ,"8 Trần Phú, Nha Trang, Khánh Hòa"
,Viện Pháp Y Quốc gia,43.974.619,CÔNG ĐOÀN Y TẾ VIỆT NAM ,Số 41 Nguyễn Đình Chiểu - Hai Bà Trưng - Hà Nội
,Bệnh viện Đa khoa Trung ương Quảng Nam,510.387.039,CÔNG ĐOÀN Y TẾ VIỆT NAM ,Xã Tam Hiệp - Huyện Núi Thành - Quảng Nam
,Bệnh viện Phụ sản Trung ương,438.252.161,CÔNG ĐOÀN Y TẾ VIỆT NAM ,"43 Tràng Thi, Hoàn Kiếm, Hà Nội"
,Bệnh viện Trung ương Huế,914481236,CÔNG ĐOÀN Y TẾ VIỆT NAM ,16 Lê Lợi - Thành phố Huế
,Bệnh viện Trung ương Thái Nguyên,2803855125,CÔNG ĐOÀN Y TẾ VIỆT NAM ,Số 479 – Đường Lương Ngọc Quyến – TP Thái Nguyên
,Bệnh viện 71 Trung ương,373675701,CÔNG ĐOÀN Y TẾ VIỆT NAM ,Quảng Tâm - TP Thanh Hóa - Tỉnh Thanh Hóa
,Bệnh viện C Đà Nẵng,2363821480,CÔNG ĐOÀN Y TẾ VIỆT NAM ,"122 Hải Phòng, Thạch Thang, Hải Châu, Đà Nẵng"
,Bệnh viện Phong Da liễu TW Quỳnh Lập,383665888,CÔNG ĐOÀN Y TẾ VIỆT NAM ,"Phường Quỳnh Thiện, Thị xã Hoàng Mai, Tỉnh Nghệ An"
,Bệnh viện Phong Da liễu TW Quy Hòa,563747999,CÔNG ĐOÀN Y TẾ VIỆT NAM ,Phường Ghềnh Ráng - TP. Quy Nhơn - Tỉnh Bình Định
,Bệnh viện Răng Hàm Mặt Trung ương Hà Nội,4338269722,CÔNG ĐOÀN Y TẾ VIỆT NAM ,40 Tràng Thi - Hoàn Kiếm - Hà Nội
,Bệnh viện Tâm thần Trung ương 2,613822965,CÔNG ĐOÀN Y TẾ VIỆT NAM ,"Đường Nguyễn Ái Quốc, KP7, P. Tân Phong, Tp Biên Hoà, tỉnh Đồng Nai"
,Bệnh viện Việt Nam - Cu Ba Đồng Hới,2323825105,CÔNG ĐOÀN Y TẾ VIỆT NAM ,"Nam Lý, Tp. Đồng Hới, Quảng Bình"
,Bệnh viện Việt Nam - Thụy Điển Uông Bí,333.854.037,CÔNG ĐOÀN Y TẾ VIỆT NAM ,"Đường Tuệ Tĩnh, Phường Thanh Sơn, Thành phố Uông Bí, Tỉnh Quảng Ninh"
,Bệnh viện K Trung ương,438252143,CÔNG ĐOÀN Y TẾ VIỆT NAM ,"43 Quán Sứ, Hàng Bông, Hoàn Kiếm, Hà Nội"
,Bệnh viện Tai Mũi Họng Trung ương,438686251,CÔNG ĐOÀN Y TẾ VIỆT NAM ,78 Đường Giải Phóng - Đống Đa - Hà Nội
,Bệnh viện Hữu nghị,439722231,CÔNG ĐOÀN Y TẾ VIỆT NAM ,"Số 1 Trần Khánh Dư, Hai Bà Trưng, Hà Nội"
,Bệnh viện Hữu nghị Việt Đức,438253531,CÔNG ĐOÀN Y TẾ VIỆT NAM ,"40 Tràng Thi, Hoàn Kiếm, Hà Nội"
,Bệnh viện E,437543832,CÔNG ĐOÀN Y TẾ VIỆT NAM ,"89 Trần Cung, Nghĩa Tân, Cầu Giấy, Hà Nội"
,Bệnh viện Nhi Trung ương,462738532,CÔNG ĐOÀN Y TẾ VIỆT NAM ,18/879 La Thành – Đống Đa – Hà Nội
,Bệnh viện Nội tiết Trung ương,438533527,CÔNG ĐOÀN Y TẾ VIỆT NAM ,Tứ Hiệp - Thanh Trì - Hà Nội
,Bệnh viện Châm cứu Trung ương,435627662,CÔNG ĐOÀN Y TẾ VIỆT NAM ,"49 Thái Thịnh, Thịnh Quang, Đống Đa, Hà Nội"
,Bệnh viện Y học cổ truyền Trung ương,438263616,CÔNG ĐOÀN Y TẾ VIỆT NAM ,"29 Nguyễn Bỉnh Khiêm, Hà Nội"
,Bệnh viện Phổi Trung ương,48326249,CÔNG ĐOÀN Y TẾ VIỆT NAM ,"Số 463, đường Hoàng Hoa Thám, quận Ba Đình, Hà Nội"
,Bệnh viện Mắt Trung ương,438263966,CÔNG ĐOÀN Y TẾ VIỆT NAM ,"85 Bà Triệu, Nguyễn Du, Hai Bà Trưng, Hà Nội"
,Bệnh viện Da liễu Trung ương,432222944,CÔNG ĐOÀN Y TẾ VIỆT NAM ,15A - Phương Mai - Quận Đống Đa - Hà Nội
,CĐCS Viện Huyết học và Truyền máu Trung ương,438685582,CÔNG ĐOÀN Y TẾ VIỆT NAM ,"Trần Thái Tông, Yên Hoà, Cầu Giấy, Hà Nội"
,CĐCS Bệnh viện Lão khoa Trung ương,435764558,CÔNG ĐOÀN Y TẾ VIỆT NAM ,"1A Phương Mai, Đống Đa, Hà Nội"
,Bệnh viện Trung ương Cần Thơ,7103820071,CÔNG ĐOÀN Y TẾ VIỆT NAM ,"315 Nguyễn Văn Linh P. An Khánh, Q. Ninh Kiều TP. Cần Thơ"
,Bệnh viện Bạch Mai,438.693.731,CÔNG ĐOÀN Y TẾ VIỆT NAM ,"Số 78 Đường Giải Phóng, Phương Mai, Đống Đa, Hà Nội"
,Bệnh viện Điều dưỡng PHCN TW,912246447,CÔNG ĐOÀN Y TẾ VIỆT NAM ,"Đường Nguyễn Du, P.Trường Sơn, TX. Sầm Sơn, Tỉnh Thanh Hóa"
,Bệnh viện tâm thần Trung ương 1,2433853227,CÔNG ĐOÀN Y TẾ VIỆT NAM ,Thường Tín - Hà Nội
,Bệnh viện 74 Trung ương,2.116.268.627,CÔNG ĐOÀN Y TẾ VIỆT NAM ,Phường Hùng Vương - Thị xã Phúc Yên - Tỉnh Vĩnh Phúc
,Bệnh viện Nhiệt đới Trung ương,435.763.491,CÔNG ĐOÀN Y TẾ VIỆT NAM ,"Số 78, Đường Giải Phóng, Hà Nội."
,Đại học Y Dược Thái Bình,363.838.545,CÔNG ĐOÀN Y TẾ VIỆT NAM ,"Số 373 Lý Bôn, TP. Thái Bình, tỉnh Thái Bình"
,Đại học Điều dưỡng Nam Định,350.649.666,CÔNG ĐOÀN Y TẾ VIỆT NAM ,Số 257 Đường Hàn Thuyên - Thành phố Nam Định
,Đại học Dược Hà Nội,438.254.539,CÔNG ĐOÀN Y TẾ VIỆT NAM ,15 Lê Thánh Tông Quận Hoàn Kiếm TP Hà Nội
,Đại học Kỹ thuật Y - Dược Đà Nẵng,511.383.538,CÔNG ĐOÀN Y TẾ VIỆT NAM ,99 Hùng Vương - Đà Nẵng
,Học viện Y dược học Cổ truyền Việt Nam,433.824.929,CÔNG ĐOÀN Y TẾ VIỆT NAM ,Số 2 - Trần Phú - Hà Đông - Hà Nội
,Đại học Kỹ thuật Y tế Hải Dương,2.203.891.799,CÔNG ĐOÀN Y TẾ VIỆT NAM ,"Số 1, Đường Vũ Hựu, thành phố Hải Dương  tỉnh Hải Dương"
,Cao đẳng Dược Trung ương - Hải Dương,3.203.890.944,CÔNG ĐOÀN Y TẾ VIỆT NAM ,336 Nguyễn Lương Bằng - TP. HảI Dương
,Đại học Y Dược Hải phòng,313.731.907,CÔNG ĐOÀN Y TẾ VIỆT NAM ,"Số 72A Nguyễn Bỉnh Khiêm, Ngô Quyền, Hải Phòng"
,Cao đẳng Nghề Kỹ thuật thiết bị Y tế,43.576.037,CÔNG ĐOÀN Y TẾ VIỆT NAM ,"Số 1 ngõ 89, Lương Định Của, Đống Đa, Hà Nội"
,Đại học Y Dược Cần Thơ,7.103.740.221,CÔNG ĐOÀN Y TẾ VIỆT NAM ,"Số 179, đường Nguyễn Văn Cừ, P. An Khánh, Q. Ninh Kiều, TP. Cần Thơ"
,Đại học Y Hà Nội,438.523.798,CÔNG ĐOÀN Y TẾ VIỆT NAM ,01 Tôn Thất Tùng-Đống Đa-Hà Nội
,Đại học Y tế công cộng,462.662.299,CÔNG ĐOÀN Y TẾ VIỆT NAM ,"Số 1A, đường Đức Thắng, phường Đức Thắng, quận Bắc Từ Liêm, thành phố Hà Nội"
,Cơ quan TW Hội Đông Y Việt Nam,439.350.572,CÔNG ĐOÀN Y TẾ VIỆT NAM ,"19 Phố Tông Đản, Q. Hoàn Kiếm, Hà Nộ"
,Công ty TNHH MTV Dược khoa,439.332.607,CÔNG ĐOÀN Y TẾ VIỆT NAM ,"Số 9 Nguyễn Công Trứ, P. Phạm Đình Hổ, Q. Hai Bà Trưng, Hà Nội"
,Tạp chí Y Dược học thực hành,422.141.493,CÔNG ĐOÀN Y TẾ VIỆT NAM ,138A Giảng Võ - Ba Đình - Hà Nội
,Công đoàn Y tế Việt Nam,438461716,CÔNG ĐOÀN Y TẾ VIỆT NAM ,138c Giảng Võ - Ba Đình - Hà Nội
,CĐCS Cơ quan Bộ Y tế,462732273,CÔNG ĐOÀN Y TẾ VIỆT NAM ,138 A - Giảng Võ - Ba Đình - Hà Nội
,CĐCS Tổng hội Y học Việt Nam,439439323,CÔNG ĐOÀN Y TẾ VIỆT NAM ,"68A Phố Bà Triệu, Phường Hàng Bài, Quận Hoàn Kiếm, Hà Nội"
,Trung tâm Pháp Y tâm thần miền núi phía Bắc,0210 6262 966,CÔNG ĐOÀN Y TẾ VIỆT NAM ,"68, Cao Bằng, Âu Cơ, Tx. Phú Thọ, Phú Thọ"
,Trung tâm Pháp Y tâm thần Khu vực miền Trung,2343588827,CÔNG ĐOÀN Y TẾ VIỆT NAM ,"39 Phạm Thị Liên, Phường Kim Long, Thành phố Huế, Tỉnh Thừa Thiên - Huế"
,Trung tâm Pháp y tâm thần khu vực Tây Nguyên,5003526222,CÔNG ĐOÀN Y TẾ VIỆT NAM ,"Số 134 Nguyễn Thị Định, TP. Buôn Ma Thuột, tỉnh Đăk Lăk"
,Trung tâm Pháp Y tâm thần khu vực Tây Nam Bộ,7103738116,CÔNG ĐOÀN Y TẾ VIỆT NAM ,"315 Nguyễn Văn Linh, Phường An Khánh, Quận Ninh Kiều, Cần Thơ"
,Trung tâm Pháp y Tâm thần khu vực TP. Hồ Chí Minh,838561987,CÔNG ĐOÀN Y TẾ VIỆT NAM ,"152-154, 400/12 Hồng Bàng, phường 16, Quận 5, Hồ Chí Minh"
,Trung tâm Truyền thông - Giáo dục sức khỏe Trung ương,43.832.751,CÔNG ĐOÀN Y TẾ VIỆT NAM ,"366 Đội Cấn, Ba Đình, Hà Nội"
,Tổng cục Dân số - Kế hoạch hóa gia đình,438.435.297,CÔNG ĐOÀN Y TẾ VIỆT NAM ,Tòa nhà lô D20 - Ngõ số 8 Tôn Thất Thuyết – Mỹ Đình 2 – Nam Từ Liêm - Hà Nội
,Báo Sức khỏe và Đời sống,438.461.042,CÔNG ĐOÀN Y TẾ VIỆT NAM ,8A Giảng Võ - Hà Nội
,Công Ty Cổ phần Dược phẩm Trung ương Codupha,838650834,CÔNG ĐOÀN Y TẾ VIỆT NAM ,"334 Tô Hiến Thành, Phường 14, Quận 10, TP.HCM"
,Công ty Cổ phần Dược TW3,2363817552,CÔNG ĐOÀN Y TẾ VIỆT NAM ,"115 Ngô Gia Tự, P. Hải Châu 1, Q. Hải Châu, TP. Đà Nẵng"
,Tổng Công ty Thiết bị Y tế Việt Nam - CTCP,438235679,CÔNG ĐOÀN Y TẾ VIỆT NAM ,"Số 1 ngõ 135, phố Núi Trúc, P. Kim Mã, Q. Ba Đình, Hà Nội"
,Công ty Cổ phần Vắc xin & Sinh phẩm Nha Trang,583813067,CÔNG ĐOÀN Y TẾ VIỆT NAM ,"26 Hàn Thuyên, P. Xương Huân, Tp. Nha Trang, T. Khánh Hòa"
,Công ty TNHH MTV Nhà xuất bản Y học,437627819,CÔNG ĐOÀN Y TẾ VIỆT NAM ,"Số 352 Đội Cấn, Phường Cống Vị, Quận Ba Đình, TP Hà Nội"
,Công ty TNHH MTV Vắc xin & Sinh phẩm Y tế số 1,49717710,CÔNG ĐOÀN Y TẾ VIỆT NAM ,Số 1 Yersin - Hà Nội
,Công ty TNHH MTV Vắc xin Pasteur Đà Lạt,633836613,CÔNG ĐOÀN Y TẾ VIỆT NAM ,Số 18 Lê Hồng Phong - Đà Lạt - Lâm Đồng
,Tổng Công ty Dược Việt Nam - CTCP,438443151,CÔNG ĐOÀN Y TẾ VIỆT NAM ,12 Ngô Tất Tố - Văn Miếu - Đống Đa - Hà Nội
,Công ty Cổ phần Dược phẩm Trung ương 2,49716279,CÔNG ĐOÀN Y TẾ VIỆT NAM ,Số 9 Trần Thánh Tông - Phường Bạch Đằng - Quận Hai Bà Trưng- Hà Nội
,Công ty Cổ phần Dược phẩm Trung ương 3,313842576,CÔNG ĐOÀN Y TẾ VIỆT NAM ,"16 Lê Đại Hành, Phường Minh Khai, Hồng Bàng, Hải Phòng"
,Công ty Cổ phần Hóa Dược Việt Nam,436557429,CÔNG ĐOÀN Y TẾ VIỆT NAM ,"192 Đức Giang, Thượng Thanh, Long Biên, Hà Nội"
,Công ty Cổ phần Dược Danapha,2363757676,CÔNG ĐOÀN Y TẾ VIỆT NAM ,"253 Dũng Sĩ Thanh Khê, Thanh Khê, Đà Nẵng"
,Công ty Cổ phần Dược phẩm TW25,839404351,CÔNG ĐOÀN Y TẾ VIỆT NAM ,"448 Nguyễn Tất Thành, 18, Quận 4, Hồ Chí Minh"
,Công ty Cổ phần Dược phẩm Trung ương Vidipha,838440106,CÔNG ĐOÀN Y TẾ VIỆT NAM ,"19 Nguyễn Văn Trỗi, 12, Phú Nhuận, Hồ Chí Minh"
,Công ty Cổ phần Dược liệu Trung ương 2,838323058,CÔNG ĐOÀN Y TẾ VIỆT NAM ,"24, Nguyễn Thị Nghĩa, Phường Bến Thành, Quận 1, Thành Phố Hồ Chí Minh"
,Công ty Cổ phần XNK Y tế Việt Nam,438430400,CÔNG ĐOÀN Y TẾ VIỆT NAM ,"138 Giảng Võ, Phường Kim Mã, Quận Ba Đình, Hà Nội."
,Công Ty Cổ Phần Dược Trung Ương Medipharco – Tenamyd,2343832814,CÔNG ĐOÀN Y TẾ VIỆT NAM ,"8 Nguyễn Trường Tộ, Phước Vĩnh, Tp. Huế, Thừa Thiên Huế"
,Công ty CP Nhựa Y Tế Mediplast,435760771,CÔNG ĐOÀN Y TẾ VIỆT NAM ,"89 Phố Lương Định Của, Phương Mai, Đống Đa, Hà Nội"
,Công ty Cổ phần Y Dược phẩm Vimedimex,839254264,CÔNG ĐOÀN Y TẾ VIỆT NAM ,"246 Cống Quỳnh, Phường Phạm Ngũ Lão, Quận 1, TP. Hồ Chí Minh"
,Công ty Cổ phần Bao bì Dược,838.445.025,CÔNG ĐOÀN Y TẾ VIỆT NAM ,"89 Nguyễn Đình Chiểu, P.4, Q.Phú Nhuận, Tp.Hồ Chí Minh"
,Công ty Cổ phần Dược phẩm IMEXPHARM,673.851.168,CÔNG ĐOÀN Y TẾ VIỆT NAM ,"số 04 đường 30/4, phường 1, Tp Cao Lãnh, tỉnh Đồng Tháp"
,Công ty CP Dược phẩm TW1 - Pharbaco,438.454.561,CÔNG ĐOÀN Y TẾ VIỆT NAM ,"160 Tôn Đức Thắng, Đống Đa, Hà Nội"
,Công ty Cổ phần Dược phẩm Trung ương CPC1,438.643.327,CÔNG ĐOÀN Y TẾ VIỆT NAM ,"Số 356A Đường Giải Phóng, Quận Thanh Xuân, Hà Nội"
,Công ty CP Dược Trung ương MEDIPLANTEX,43.864.336,CÔNG ĐOÀN Y TẾ VIỆT NAM ,358 Đường Giải Phóng - Thanh Xuân - Hà Nội
,Công ty Cổ phần Dược phẩm OPC,837.517.111,CÔNG ĐOÀN Y TẾ VIỆT NAM ,"Số 1017 - Hồng Bàng , P12 , Q.6 - TP.HCM"
,Công ty CP Hóa-Dược phẩm MEKOPHAR,838.650.258,CÔNG ĐOÀN Y TẾ VIỆT NAM ,"297/5 Lý Thường Kiệt, Quận 11, Tp Hồ Chí Minh, Việt Nam"
,Công ty CP Xuất nhập khẩu Y tế Việt Nam,4.384.304,CÔNG ĐOÀN Y TẾ VIỆT NAM ,Số 138 Giảng Võ - Hà Nội
,CĐCS NHNN Chi nhánh tỉnh An Giang (Đại diện CĐNHVN trên địa bàn tỉnh An Giang),076. 3841 267,CÔNG ĐOÀN NGÂN HÀNG VIỆT NAM,"Số 01 Hùng Vương, TP. Long Xuyên, tỉnh An Giang"
,CĐCS NHNN Chi nhánh tỉnh Bà Rịa - Vũng Tàu (Đại diện CĐNHVN trên địa bàn tỉnh Bà Rịa – Vũng Tàu),064. 3856 814,CÔNG ĐOÀN NGÂN HÀNG VIỆT NAM,"Số 24 Trần Hưng Đạo, TP. Vũng Tàu, tỉnh Bà Rịa - Vũng Tàu"
,CĐCS NHNN Chi nhánh tỉnh Bắc Kạn (Đại diện CĐNHVN trên địa bàn tỉnh Bắc Kạn),0281. 3811 699,CÔNG ĐOÀN NGÂN HÀNG VIỆT NAM,"Số 23 Hùng Vương, TX. Bắc Kạn, tỉnh Bắc Kạn"
,CĐCS NHNN Chi nhánh tỉnh Bạc Liêu (Đại diện CĐNHVN trên địa bàn tỉnh Bạc Liêu),0781. 3823 740,CÔNG ĐOÀN NGÂN HÀNG VIỆT NAM,"Số 02 Trần Huỳnh, TX. Bạc Liêu, tỉnh Bạc Liêu"
,CĐCS NHNN Chi nhánh tỉnh Bắc Ninh (Đại diện CĐNHVN trên địa bàn tỉnh Bắc Ninh),0241. 3822 682,CÔNG ĐOÀN NGÂN HÀNG VIỆT NAM,"Số 20 Lý Thái Tổ, TP. Bắc Ninh, tỉnh Bắc Ninh"
,CĐCS NHNN Chi nhánh tỉnh Bắc Giang (Đại diện CĐNHVN trên địa bàn tỉnh Bắc Giang),0240. 3554 116,CÔNG ĐOÀN NGÂN HÀNG VIỆT NAM,"Số 47 Nguyễn Văn Cừ, TP. Bắc Giang, tỉnh Bắc Giang"
,CĐCS NHNN Chi nhánh tỉnh Bến Tre (Đại diện CĐNHVN trên địa bàn tỉnh Bến Tre),075. 3829 591,CÔNG ĐOÀN NGÂN HÀNG VIỆT NAM,"Số 100P Nguyễn Văn Tư, TX. Bến Tre, tỉnh Bến Tre"
,CĐCS NHNN Chi nhánh tỉnh Bình Dương (Đại diện CĐNHVN trên địa bàn tỉnh Bình Dương),0650. 3822 236,CÔNG ĐOÀN NGÂN HÀNG VIỆT NAM,"Số 161Phú Lợi, P. Phú Lợi, TX. Thủ Dầu Một, tỉnh Bình Dương"
,CĐCS NHNN Chi nhánh tỉnh Bình Định (Đại diện CĐNHVN trên địa bàn tỉnh Bình Định),056. 3521 495,CÔNG ĐOÀN NGÂN HÀNG VIỆT NAM,"Số 208 Diên Hồng, TP. Quy Nhơn, tỉnh Bình Định"
,CĐCS NHNN Chi nhánh tỉnh Bình Phước (Đại diện CĐNHVN trên địa bàn tỉnh Bình Phước),0651. 3870 048,CÔNG ĐOÀN NGÂN HÀNG VIỆT NAM,"Số 618 QL 14, P. Tân Phú, TX. Đồng Xoài, tỉnh Bình Phước"
,CĐCS NHNN Chi nhánh tỉnh Bình Thuận (Đại diện CĐNHVN trên địa bàn tỉnh Bình Thuận),062. 3821 849,CÔNG ĐOÀN NGÂN HÀNG VIỆT NAM,"Số 03 Lê Hồng Phong, TP. Phan Thiết, tỉnh Ninh Thuận"
,CĐCS NHNN Chi nhánh tỉnh Cà Mau (Đại diện CĐNHVN trên địa bàn tỉnh Cà Mau),0780. 3831 671,CÔNG ĐOÀN NGÂN HÀNG VIỆT NAM,"Số 2 - 3 Lý Bụn, TP. Cà Mau, tỉnh Cà Mau"
,CĐCS NHNN Chi nhánh tỉnh Cao Bằng (Đại diện CĐNHVN trên địa bàn tỉnh Cao Bằng),026. 3852 653,CÔNG ĐOÀN NGÂN HÀNG VIỆT NAM,"Số 03 Hoàng Như, TX. Cao Bằng, tỉnh Cao Bằng"
,CĐCS NHNN Chi nhánh thành phố Cần Thơ (Đại diện CĐNHVN trên địa bàn thành  phố Cần Thơ),0710. 3820 451,CÔNG ĐOÀN NGÂN HÀNG VIỆT NAM,"Số 02 Ngô Gia Tự, TP. Cần Thơ"
,CĐCS NHNN Chi nhánh thành phố Đà Nẵng (Đại diện CĐNHVN trên địa bàn tỉnh Đà Nẵng),0236. 3821 982,CÔNG ĐOÀN NGÂN HÀNG VIỆT NAM,"Số 48 Trần Phú, TP. Đà Nẵng"
,CĐCS NHNN Chi nhánh tỉnh Đắk Lắk (Đại diện CĐNHVN trên địa bàn tỉnh Đắk Lắk),0500. 3857 598,CÔNG ĐOÀN NGÂN HÀNG VIỆT NAM,"Số 148 Nguyễn Tất Thành, TP. Buôn Ma Thuột, tỉnh Đăk Lăk"
,CĐCS NHNN Chi nhánh tỉnh Đắk Nông (Đại diện CĐNHVN trên địa bàn tỉnh Đắk Nông),0501. 3544 687,CÔNG ĐOÀN NGÂN HÀNG VIỆT NAM,"Số 201 đường 32/3, TX. Gia Nghĩa, tỉnh Đăk Nông"
,CĐCS NHNN Chi nhánh tỉnh Đồng Nai (Đại diện CĐNHVN trên địa bàn tỉnh Đồng Nai),061. 3816 190,CÔNG ĐOÀN NGÂN HÀNG VIỆT NAM,"Số 85 - 93 đường 30/4, TP. Biên Hoà, tỉnh Đồng Nai"
,CĐCS NHNN Chi nhánh tỉnh Đồng Tháp (Đại diện CĐNHVN trên địa bàn tỉnh Đồng Tháp),067. 3852 198,CÔNG ĐOÀN NGÂN HÀNG VIỆT NAM,"Số 50 Lý Thường Kiệt, TP. Cao Lãnh, tỉnh Đồng Tháp"
,CĐCS NHNN Chi nhánh tỉnh Điện Biên (Đại diện CĐNHVN trên địa bàn tỉnh Điện Biên),0215. 3825 879,CÔNG ĐOÀN NGÂN HÀNG VIỆT NAM,"Số 890 Mường Thanh, TP. Điện Biên, tỉnh Điện Biên"
,CĐCS NHNN Chi nhánh tỉnh Gia Lai (Đại diện CĐNHVN trên địa bàn tỉnh Gia Lai),059. 3866 555,CÔNG ĐOÀN NGÂN HÀNG VIỆT NAM,"Số 05 Trần Hưng Đạo, TP. Pleiku, tỉnh Gia Lai"
,CĐCS NHNN Chi nhánh thành phố Hà Nội (Đại diện CĐNHVN trên địa bàn thành phố Hà Nội),024. 3825 3962,CÔNG ĐOÀN NGÂN HÀNG VIỆT NAM,"Số 45 Lý Thường Kiệt, TP. Hà Nội"
,CĐCS NHNN Chi nhánh tỉnh Hà Giang (Đại diện CĐNHVN trên địa bàn tỉnh Hà Giang),0219. 3866 473,CÔNG ĐOÀN NGÂN HÀNG VIỆT NAM,"Số 521 Nguyễn Trãi, TX. Hà Giang, tỉnh Hà Giang"
,CĐCS NHNN Chi nhánh tỉnh Hà Nam (Đại diện CĐNHVN trên địa bàn tỉnh Hà Nam),0351. 3852 580,CÔNG ĐOÀN NGÂN HÀNG VIỆT NAM,"Số 110 Nguyễn Viết Xuân, TX. Phủ Lý, tỉnh Hà Nam"
,CĐCS NHNN Chi nhánh tỉnh Hà Tĩnh (Đại diện CĐNHVN trên địa bàn tỉnh Hà Tĩnh),0239. 3856 985,CÔNG ĐOÀN NGÂN HÀNG VIỆT NAM,"Số 13 Trần Phú, TX. Hà Tĩnh, tỉnh Hà Tĩnh"
,CĐCS NHNN Chi nhánh tỉnh Hải Dương (Đại diện CĐNHVN trên địa bàn tỉnh Hải Dương),0320. 3840 066,CÔNG ĐOÀN NGÂN HÀNG VIỆT NAM,"Số 83 Bạch Đằng, TP. Hải Dương, tỉnh Hải Dương"
,CĐCS NHNN Chi nhánh thành phố Hải Phòng (Đại diện CĐNHVN trên địa bàn thành phố Hải Phòng),031. 3842 457,CÔNG ĐOÀN NGÂN HÀNG VIỆT NAM,"Số 04 Nguyễn Tri Phương,TP. Hải Phòng"
,CĐCS NHNN Chi nhánh tỉnh Hậu Giang (Đại diện CĐNHVN trên địa bàn tỉnh Hậu Giang),0711. 3870 085,CÔNG ĐOÀN NGÂN HÀNG VIỆT NAM,"Số 28B đường 30/4 ,TX. Vị Thanh, tỉnh Hậu Giang"
,CĐCS NHNN Chi nhánh tỉnh Hòa Bình (Đại diện CĐNHVN trên địa bàn tỉnh Hòa Bình),0218. 3852 440,CÔNG ĐOÀN NGÂN HÀNG VIỆT NAM,"Số 07 An Dương Vương, TP. Hoà Bình, tỉnh Hòa Bình"
,CĐCS NHNN Chi nhánh tỉnh Hưng Yên (Đại diện CĐNHVN trên địa bàn tỉnh Hưng Yên),0321. 3552 679,CÔNG ĐOÀN NGÂN HÀNG VIỆT NAM,"Số 306 Nguyễn Văn Linh, TX. Hưng Yên, tỉnh Hưng Yên"
